{
  "$schema": "ldfreq-installed-resource-manifest.schema.json",
  "schema_version": "2.0.0",
  "package_scope": "optional-reference-resources",
  "runtime_policy": {
    "network_access": false,
    "implicit_download_or_fallback": false,
    "explicit_download_api": "lexdiv_download_resources"
  },
  "resources": [
    {
      "resource_id": "tubelex-en-treebank-slim",
      "resource_version": "7cb5fb36-slim-v1",
      "distribution": "explicit-download",
      "runtime_state": "optional",
      "public_api": true,
      "license_spdx": "BSD-3-Clause",
      "source_repository": "https://github.com/naist-nlp/tubelex",
      "source_commit": "7cb5fb36add76b83a266d1967536e1a1d3faa513",
      "source_sha256": "4096022259d5eaa7261c3bf22c3b0af9fd58ae8eebe17894c0b34a163954f936",
      "raw_source_bundled": false,
      "raw_subtitles_or_identifiers_included": false,
      "manifest_sha256": "a8d5dc3b2a5fee7eadf5a0648762350f9835b4b5e2633d9fe428dcf210120591",
      "artifact_sha256": "ded083e5b9f59ddfb719ebd88063778500cb347e1eab0f2d79ff55085d92fb4d",
      "content_sha256": "423dd4631c9da2f7442705d2930126da4cba980e46b6a5c0dda98336dce74916",
      "notice_path": "licenses/tubelex/NOTICE.md",
      "provenance_path": "extdata/tubelex/7cb5fb36/build-provenance.json",
      "package_members": [
        {
          "path": "COPYRIGHTS",
          "role": "code attribution",
          "bytes": 1129,
          "sha256": "8ff5b4750bf9aaae9fd5044a48de8f4c03898694943ee45a23b20ca20b467533"
        },
        {
          "path": "licenses/tubelex/NOTICE.md",
          "role": "adapted code notice",
          "bytes": 494,
          "sha256": "3ea8452c2b04c63e56a2391b9c4e0e8bc31345c299d26c1b4c4ef0fe598e08be"
        },
        {
          "path": "licenses/tubelex/LICENSE",
          "role": "adapted code license",
          "bytes": 1521,
          "sha256": "51b9e39825bbf19e4bb777bf11a7520a3935ff859c4d0ee724dfe9ddb26a961f"
        },
        {
          "path": "examples/tubelex-tokenize.py",
          "role": "adapted code example",
          "bytes": 8184,
          "sha256": "abe30786ceedc28495f9742ffdd28b308c0934262f76675ca3808897c5c506f0"
        }
      ],
      "resource_name": "tubelex",
      "download": {
        "version": "7cb5fb36",
        "license": "BSD-3-Clause",
        "license_url": "https://opensource.org/license/bsd-3-clause",
        "citation": "Nohejl et al. (2025). Beyond Film Subtitles. https://aclanthology.org/2025.coling-main.641/",
        "url": "https://github.com/Ryuya-dot-com/ldfreq/releases/download/reference-data-20261024/ldfreq-resource-tubelex-7cb5fb36.tar.gz",
        "bytes": 2557276,
        "sha256": "2b192ddd6d972d230a3c0b2198c89f33269f5a35c4b0d0cfec9231fb10340aa4",
        "files": {
          "README.txt": "0220774aa5993e0056dd32eff9406ef06db9d126eab0c75ed410d2927640f836",
          "extdata/tubelex/7cb5fb36/build-provenance.json": "834e70d09b983f75c6623fb56191706d1ec6f5f836c249a88816a1d93d2336f8",
          "extdata/tubelex/7cb5fb36/resource.manifest.dcf": "a8d5dc3b2a5fee7eadf5a0648762350f9835b4b5e2633d9fe428dcf210120591",
          "extdata/tubelex/7cb5fb36/tubelex_en_treebank_7cb5fb36_slim.csv.gz": "ded083e5b9f59ddfb719ebd88063778500cb347e1eab0f2d79ff55085d92fb4d",
          "licenses/tubelex/NOTICE.md": "a3ea8312a5bbf8e7178155259460f089d0377a8c99094f70875910c428cb4cb5"
        }
      },
      "paths_relative_to": "verified-resource-cache"
    },
    {
      "resource_id": "new-jacet8000",
      "resource_version": "jacet2016-8000-v1",
      "distribution": "explicit-download",
      "runtime_state": "optional",
      "public_api": true,
      "license_spdx": null,
      "license_name": "JACET permission with source attribution",
      "source_repository": null,
      "source_commit": null,
      "source_url": "https://language.sakura.ne.jp/s/doc/voc/j8_2016.xlsx",
      "source_sha256": "1433dcd94135f86cfdbcbf5bafc209661678f1104f5062041b737834e99d3cf8",
      "raw_source_bundled": false,
      "raw_subtitles_or_identifiers_included": false,
      "manifest_sha256": "6a802a0de9a4fd534d224508586fbefff764890839a4fb4c896b9e1b0e4035b0",
      "artifact_sha256": "6797238778c4b67bdce9657f16bfbdcc65982c72e4fd29eca93f7fef2d010f59",
      "content_sha256": "6797238778c4b67bdce9657f16bfbdcc65982c72e4fd29eca93f7fef2d010f59",
      "notice_path": "licenses/nj8/NOTICE.md",
      "provenance_path": "extdata/nj8/2016/provenance.json",
      "package_members": [],
      "resource_name": "nj8",
      "download": {
        "version": "2016",
        "license": "JACET permission; attribution required",
        "license_url": "https://www.jacet.org/official-word-list/",
        "citation": "JACET Basic Word Revision Committee (2016). The New JACET List of 8000 Basic Words. Kirihara Shoten.",
        "url": "https://github.com/Ryuya-dot-com/ldfreq/releases/download/reference-data-20261024/ldfreq-resource-nj8-2016.tar.gz",
        "bytes": 53357,
        "sha256": "39f8093fe84db2a18e1f687894a858e7e30f3550b8822a632b38a4280cc27df6",
        "files": {
          "README.txt": "0a67a6870d25fbdce49e14d42d5bef3bb4a7e8161595e308ba37d319ca87903d",
          "extdata/nj8/2016/NJ8.csv": "6797238778c4b67bdce9657f16bfbdcc65982c72e4fd29eca93f7fef2d010f59",
          "extdata/nj8/2016/provenance.json": "27754e491fab1b64f0c96efb9843fce7be27952f8e89760d8861f8712cc62826",
          "extdata/nj8/2016/resource.manifest.dcf": "6a802a0de9a4fd534d224508586fbefff764890839a4fb4c896b9e1b0e4035b0",
          "licenses/nj8/NOTICE.md": "c676ae232916910290454f5e27d643f69958d72caad53a3cd6fe259535596232"
        }
      },
      "paths_relative_to": "verified-resource-cache"
    },
    {
      "resource_id": "morpholex-en",
      "resource_version": "5bc425fbb710f3d63cab69e77ee731fa466653ed0ace94937cac6c1fd6de52c6",
      "distribution": "explicit-download",
      "runtime_state": "optional",
      "public_api": true,
      "license_spdx": "CC-BY-NC-SA-4.0",
      "source_repository": "https://github.com/hugomailhot/MorphoLex-en",
      "source_commit": null,
      "source_url": "https://github.com/hugomailhot/MorphoLex-en",
      "source_sha256": "5bc425fbb710f3d63cab69e77ee731fa466653ed0ace94937cac6c1fd6de52c6",
      "raw_source_bundled": false,
      "raw_subtitles_or_identifiers_included": false,
      "manifest_sha256": null,
      "artifact_sha256": "85d03be16c3013ab984c55bce8799699ac6a4b03992b2df0c07ab2b79dc8b2b1",
      "content_sha256": null,
      "content_scope": "All 34 workbook sheets converted to character tables, with embedded provenance and the original data dictionary. Not the original workbook.",
      "notice_path": "licenses/morpholex/NOTICE.md",
      "provenance_path": "extdata/morpholex/5bc425fb/morpholex_en.rds",
      "package_members": [],
      "resource_name": "morpholex",
      "download": {
        "version": "5bc425fb",
        "license": "CC-BY-NC-SA-4.0",
        "license_url": "https://creativecommons.org/licenses/by-nc-sa/4.0/",
        "citation": "Sanchez-Gutierrez et al. (2018). MorphoLex. https://doi.org/10.3758/s13428-017-0981-8",
        "url": "https://github.com/Ryuya-dot-com/ldfreq/releases/download/reference-data-20261024/ldfreq-resource-morpholex-5bc425fb.tar.gz",
        "bytes": 1336656,
        "sha256": "a811a596c21c63b2da3197800aab94b61260be46f766cf84b45ac45ea74e6156",
        "files": {
          "README.txt": "725af52f60159861556747c381664890fbc3df1f75d34a5105d8588367bb2ade",
          "extdata/morpholex/5bc425fb/MorphoLEX_en-Data_Dictionary.pdf": "af01e0db5e953ad3b7bbc06ea06b3c8a1af6dac60e7600d826a5e079e4068575",
          "extdata/morpholex/5bc425fb/morpholex_en.rds": "85d03be16c3013ab984c55bce8799699ac6a4b03992b2df0c07ab2b79dc8b2b1",
          "licenses/morpholex/CC-BY-NC-SA-4.0.md": "051131b5ef3596dad9bf0cffee19c248ff9751596a86b25c70f0cd82d6f6d713",
          "licenses/morpholex/NOTICE.md": "0f7547a2f5ce174e965ce54f76a18b9a3c3d4812c34aea9c21a5d48760c34506"
        }
      },
      "paths_relative_to": "verified-resource-cache"
    },
    {
      "resource_id": "bnccoca-level6",
      "resource_version": "1.0.0; sha256:ac81c7a60e5c76cd2bbf0c59b0501808f0d4fa026b2936919dd54329a9bb6a69",
      "distribution": "explicit-download",
      "runtime_state": "optional",
      "public_api": true,
      "license_spdx": "CC-BY-SA-4.0",
      "source_repository": null,
      "source_commit": null,
      "source_url": "https://www.wgtn.ac.nz/lals/resources/paul-nations-resources/vocabulary-analysis-programs/range/BNC_COCA_25000.zip",
      "source_sha256": "ac81c7a60e5c76cd2bbf0c59b0501808f0d4fa026b2936919dd54329a9bb6a69",
      "raw_source_bundled": false,
      "raw_subtitles_or_identifiers_included": false,
      "manifest_sha256": null,
      "artifact_sha256": "c44bce49580066d8216f34f9643203fe0041a5735664ac9bbf580fcbe5e12ad1",
      "content_sha256": null,
      "content_scope": "25,000 Level 6 families (75,679 rows) and 29,798 separate supplementary rows. Placeholder lists 26-30 and Range software excluded.",
      "notice_path": "licenses/bnccoca/NOTICE.md",
      "provenance_path": "extdata/bnccoca/ac81c7a6/bnccoca.rds",
      "package_members": [],
      "resource_name": "bnccoca",
      "download": {
        "version": "ac81c7a6",
        "license": "CC-BY-SA-4.0",
        "license_url": "https://creativecommons.org/licenses/by-sa/4.0/",
        "citation": "Nation's BNC/COCA Level 6 word-family lists. https://www.wgtn.ac.nz/lals/resources/paul-nations-resources/vocabulary-analysis-programs",
        "url": "https://github.com/Ryuya-dot-com/ldfreq/releases/download/reference-data-20261024/ldfreq-resource-bnccoca-ac81c7a6.tar.gz",
        "bytes": 518734,
        "sha256": "0469e4e5189be843e643611409c52be0b14da3bb045fd2193a9bd10e5d29df1f",
        "files": {
          "README.txt": "7073faf90d8143cf2a7b74b797ecbd7a2734d491c29ffd4e5f111a039986c23e",
          "extdata/bnccoca/ac81c7a6/bnccoca.rds": "c44bce49580066d8216f34f9643203fe0041a5735664ac9bbf580fcbe5e12ad1",